{
  "reportVersion": "1.0.0",
  "generatorName": "smart-home-sim-home-generator",
  "generatorVersion": "1.1.0",
  "success": true,
  "policyId": "compact-grid",
  "policyVersion": "1.1.0",
  "policySha256": "d1c380a341f97f88df2d15635753a871c8d66780970f66d282a0fa8776646392",
  "sourceScenarioId": "barcelona_tommaso_gardener_week",
  "sourceScenarioSha256": "0adc820d9217a1120322078886edb6ec93035019878314899b376fa5c689c915",
  "sourceBehaviorPackageId": "tommaso_bianchi_processes",
  "sourceBehaviorPackageSha256": "641165996e95061656692814de980e4f35351d98986cbc40c7a7fbb742c74ad0",
  "homeId": "barcelona_apartment_tommaso",
  "homeVersion": "1.0.0",
  "homeSha256": "cf076814b952bc0dd2784de777d3287528c71e9119db73e2d8834e757fcad93e",
  "issues": [],
  "summary": {
    "regionCount": 10,
    "connectionCount": 9,
    "entityCount": 14,
    "locationBindingCount": 10,
    "resourceBindingCount": 3,
    "errorCount": 0
  }
}
