{
  "reportVersion": "1.0.0",
  "generatorName": "smart-home-sim-home-generator",
  "generatorVersion": "1.1.0",
  "success": true,
  "policyId": "compact-grid",
  "policyVersion": "1.1.0",
  "policySha256": "d1c380a341f97f88df2d15635753a871c8d66780970f66d282a0fa8776646392",
  "sourceScenarioId": "mario_rossi_week_2026",
  "sourceScenarioSha256": "ed5e447dff642336bcf796ba72653dec15d5a9defd39cabb7e84dd988d8510ad",
  "sourceBehaviorPackageId": "mario_rossi_week_2026_behavior",
  "sourceBehaviorPackageSha256": "de7cddc398c0055d5781f21c3f4993890efba6a1626b8809b6def7d50bd3378f",
  "homeId": "synthetic_mario_rome_apartment_logical_v1",
  "homeVersion": "1.0.0",
  "homeSha256": "dc07fa1f2786cf2a747aeeeb7b6fa761bfc55c8fe17d707567182570193b48b6",
  "issues": [],
  "summary": {
    "regionCount": 8,
    "connectionCount": 7,
    "entityCount": 13,
    "locationBindingCount": 8,
    "resourceBindingCount": 4,
    "errorCount": 0
  }
}
