{
  "reportVersion": "1.0.0",
  "generatorName": "smart-home-sim-home-generator",
  "generatorVersion": "1.1.0",
  "success": true,
  "policyId": "compact-grid",
  "policyVersion": "1.1.0",
  "policySha256": "d1c380a341f97f88df2d15635753a871c8d66780970f66d282a0fa8776646392",
  "sourceScenarioId": "mario_rossi_week_2026",
  "sourceScenarioSha256": "34f4bd9ebc7cbd084602a3e462461a5469896f8173a05597250039034b4172f9",
  "sourceBehaviorPackageId": "mario_rossi_week_2026_behavior",
  "sourceBehaviorPackageSha256": "4d8a09c1bad5e5d4d235a0c68cbc349c39ad2274a24fb21c1b27c381c7b77ad5",
  "homeId": "synthetic_mario_rome_apartment_logical_v1",
  "homeVersion": "1.0.0",
  "homeSha256": "1cc3b54ca5efce50c1b02ec3bac6ff23e00b731ed445cccd9a4491098596716e",
  "issues": [],
  "summary": {
    "regionCount": 8,
    "connectionCount": 7,
    "entityCount": 13,
    "locationBindingCount": 8,
    "resourceBindingCount": 4,
    "errorCount": 0
  }
}
