{
  "reportVersion": "1.0.0",
  "generatorName": "smart-home-sim-home-generator",
  "generatorVersion": "1.1.0",
  "success": true,
  "policyId": "apartment-plan",
  "policyVersion": "1.1.0",
  "policySha256": "ae249dc391f53476337107adf69bf2826910f8a50bf78f5f55947cef4379ad5a",
  "sourceScenarioId": "mario_rossi_autonomous_elderly_2026_10_30",
  "sourceScenarioSha256": "31d339adb481a7967cb221c8c4dc7233e7ae8d03f277802ac9ccaf6913581eac",
  "sourceBehaviorPackageId": "mario_rossi_autonomous_elderly_2026_10_30__behavior",
  "sourceBehaviorPackageSha256": "a6861b68c8fb5592c972f71ff3e6aca0287abdbfd2bade3ded30ddebfa10a2af",
  "homeId": "synthetic_mario_rome_apartment_logical_v1",
  "homeVersion": "1.0.0",
  "homeSha256": "504c07f6e99465a16c665b7ad6efab140d30c44d38bf46d6c7733378e2ba3717",
  "issues": [],
  "summary": {
    "regionCount": 9,
    "connectionCount": 8,
    "entityCount": 27,
    "locationBindingCount": 10,
    "resourceBindingCount": 17,
    "errorCount": 0
  }
}
